ID Number,Name,Fed,Sex,Title,WTit,OTit,FOA,Rating,Gms,K,B-day,Flag
359200009,"Sierra, Sergio",GUA,M,,,,1798,AUG25,0,40,1978,i
7307179,"Sigui Gil, Norman",GUA,M,,,,1666,AUG25,0,20,1987,
7305702,"Simon Tecun, Jeimy Julissa",GUA,F,,,,1600,AUG25,0,40,2002,wi
7307390,"Soberanis Morales, Fernando Isaac",GUA,M,,,,1537,AUG25,0,40,2008,i
7304609,"Soch Chaclan, Celso Josue L.",GUA,M,,,,1659,AUG25,0,40,2001,i
7306350,"Solares Godoy, Jose Gabriel",GUA,M,,,,1596,AUG25,0,40,2005,i
7305850,"Solares Godoy, Pablo Andres",GUA,M,,,,1697,AUG25,0,20,1998,
7305605,"Solval Chuc, Ana Esperanza",GUA,F,,,,1479,AUG25,0,40,2007,w
7300778,"Sosa Martinez, Jorge Luis",GUA,M,,NI,,1858,AUG25,0,40,1990,i
7306873,"Sotomayor Ariza, Harold Santiago",GUA,M,,,,1627,AUG25,0,40,2004,i
7301057,"Sotomayor Villatoro, Silvia Dalila",GUA,F,WIM,WIM,,1920,AUG25,0,20,1989,wi
7302347,"Tax, Carlos",GUA,M,,,,1920,AUG25,0,40,1994,i
7302568,"Tecum, Manuel",GUA,M,,,,1809,AUG25,0,40,1987,i
7307322,"Tepeu Xot, Janet Noemi",GUA,F,,,,1596,AUG25,0,40,2006,wi
7306784,"Tiguila Sutuc, Moller Jonas",GUA,M,,,,AFM,AUG25,1904,0,2003,i
7300360,"Torres, Juan",GUA,M,,,,2074,AUG25,0,40,0,i
7301316,"Trujillo Gonzalez, Kevin Alejand",GUA,M,FM,,,2183,AUG25,0,20,1995,i
7304099,"Tzoc Alvarado, Alexander M.",GUA,M,,,,1940,AUG25,0,40,2001,i
7308833,"Urbina Rodriguez, Victor Alessandro",GUA,M,,,,1722,AUG25,0,40,2009,
7302487,"Urizar Melgar, Carlos A.",GUA,M,,,,1888,AUG25,0,40,1986,i
7301626,"Urrutia, Gabriel",GUA,M,,,,1745,AUG25,0,20,1974,
7300794,"Valdez, Alvaro",GUA,M,,,,1903,AUG25,0,40,1993,
7306903,"Valenzuela, Ruben D.",GUA,M,,,,1728,AUG25,0,40,2005,i
7304919,"Valladares, Ricardo",GUA,M,,,,1633,AUG25,0,40,1989,i
7307802,"Vasquez Linares, Emerson Baudilio",GUA,M,,,,1650,AUG25,0,40,1999,
7303912,"Vasquez Orellana, Hector",GUA,M,,,,1851,AUG25,0,20,1996,i
7303629,"Vela Alonzo, Luis A.",GUA,M,,,,1722,AUG25,0,20,1980,
7307730,"Velasquez Milian, Daniel Alejandro",GUA,M,,,,1518,AUG25,0,40,2008,
7301561,"Vidaurre B., Fernando",GUA,M,,,,1833,AUG25,0,20,1967,
7301073,"Villatoro Duque, Juan Luis",GUA,M,,,,2025,AUG25,0,40,1990,i
7300433,"Villatoro Perez, Rudy Daniel",GUA,M,,,,1994,AUG25,0,40,1986,i
7307489,"Villatoro Revolorio, Erick Jose Andre",GUA,M,,,,1447,AUG25,0,40,2001,
7300808,"Villatoro, Christopher",GUA,M,,,,AFM,AUG25,1868,0,0,i
7306563,"Voisard, Dominic",GUA,M,,,,1848,AUG25,0,20,1986,
7304790,"Yaas Coy, Jorge Andres",GUA,M,,,,1766,AUG25,0,40,1987,i
7301278,"Yuman, Vidalia",GUA,M,,,,1681,AUG25,0,20,0,i
7303971,"Zamora Ruiz, Victor A.",GUA,M,,,,1669,AUG25,0,40,1965,i
7307888,"Zamora Valenzuela, Diego Andres",GUA,M,,,,1579,AUG25,0,40,2008,
7304269,"Zuniga, Willy",GUA,M,,,,1708,AUG25,0,20,1976,i